{
  "schema_version": 1,
  "declaration_id": "fixture-agent-scope-2026-08-21-promoted",
  "adapter_id": "fixture-agent",
  "ads_id": "fixture-agent-ads-2026-08-21-promoted",
  "status": "promoted",
  "roots": [
    "sessions"
  ],
  "programs": [
    {
      "program_id": "observe-session-files",
      "root_entity_kind": "session",
      "relations": [
        {
          "relation_id": "root-transcript",
          "primitive": "KnownObject",
          "access_root": "sessions",
          "locator": "known-transcript",
          "identity_inputs": [
            "native-session-id",
            "transcript-locator"
          ],
          "bounds": {
            "max_fan_out": 1,
            "max_depth": 1,
            "max_objects": 1,
            "max_bytes": 2147483648,
            "max_rows": 0
          },
          "unavailable_behavior": "record_unavailable",
          "claim_refs": [
            "fixture-agent-source-observed"
          ]
        }
      ],
      "claim_refs": [
        "fixture-agent-source-observed"
      ],
      "root_relation_id": "root-transcript"
    }
  ],
  "blockers": [],
  "claim_refs": [
    "fixture-agent-source-observed"
  ]
}
